1325501648710623237,"@mitags que fique a lição para os conservadores no brasil . é fundamental a união e apoio ao presidente bolsonaro. vamos fortalecer a direita começaremos a votar em candidatos sugeridos por bolsonaro , estratégia que chama . prefeito sp : russomanno rj crivela bh bruno .",positive,"@mitags let the lesson stay for conservatives in brazil. it is essential to unite and support the president bolsonaro. we will strengthen the right, we will start voting for candidates suggested by bolsonaro, a strategy he calls for. mayor sp: russomanno rj crivela bh bruno."
1325501604041265173,"@leiarachor . é fundamental a união e apoio ao presidente bolsonaro. vamos fortalecer a direita começaremos a votar em candidatos sugeridos por bolsonaro , estratégia que chama . prefeito sp : russomanno rj crivela bh bruno .",positive,"@leiarachor. it is essential to unite and support the president bolsonaro. we will strengthen the right, we will start voting for candidates suggested by bolsonaro, a strategy he calls for. mayor sp: russomanno rj crivela bh bruno."
1325501457567789057,"gente, vamos esquecer um pouco a eleição americana e focar nas eleições municipais, celso russomanno para prefeito de são paulo!!",neutral,"guys, let's forget about the american election and focus on municipal elections, celso russomanno for mayor of são paulo !!"
1325501430162219015,"@leiarachor fique a lição para os conservadores no brasil . é fundamental a união e apoio ao presidente bolsonaro. vamos fortalecer a direita começaremos a votar em candidatos sugeridos por bolsonaro , estratégia que chama . prefeito sp : russomanno rj crivela bh bruno .",positive,"@leiarachor stay the lesson for conservatives in brazil. it is essential to unite and support the president bolsonaro. we will strengthen the right, we will start voting for candidates suggested by bolsonaro, a strategy he calls for. mayor sp: russomanno rj crivela bh bruno."
1325501218614022145,"@ananiasfernanda @jairbolsonaro que fique a lição para os conservadores no brasil . é fundamental a união e apoio ao presidente bolsonaro. vamos fortalecer a direita começaremos a votar em candidatos sugeridos por bolsonaro , estratégia que chama . prefeito sp : russomanno rj crivela bh bruno .",positive,"@ananiasfernanda @jairbolsonaro let the lesson remain for conservatives in brazil. it is essential to unite and support the president bolsonaro. we will strengthen the right, we will start voting for candidates suggested by bolsonaro, a strategy he calls for. mayor sp: russomanno rj crivela bh bruno."
1325500384056586241,"diz russomanno que foi criado por uma mãe de leite, negra. só falta ele dizer que é preto, nego, pretinho, negro, neguinho, mulato, caboclo, criolo e etc. pensa que o povo é idiota! #bouloserundina50",negative,"says Russomanno who was raised by a black milk mother. he just needs to say that he is black, black, black, black, black, mulatto, caboclo, criolo and etc. think the people are stupid! # bouloserundina50"
1325499951598669824,o auge do dia foi o celso russomanno acenando pra mim e pra babi,neutral,the highlight of the day was celso russomanno waving to me and babi
1325499671972876293,"""vote 10"" - celso russomanno - sp ((vote direito!!!!)) ""direita vota em direita!!!""",positive,"""vote 10"" - celso russomanno - sp ((vote right !!!!)) ""right vote on right !!!"""
1325499343823130625,"@brunomalta__ minha aposta também, arriscaria que na sexta e sábado a gente chega com marcio frança em 2º e russomanno em 4º, mas tudo embolado na margem de erro",neutral,"@brunomalta__ my bet too, I would risk that on friday and saturday we arrive with marcio france in 2nd and Russomanno in 4th, but everything is tangled in the margin of error"
1325498872823754753,"@izabellefores são paulo, voto em russomanno para prefeito e edson salomão para vereador.",neutral,"@izabellefores são paulo, vote in russomanno for mayor and edson salomão for councilor."
1325497864978649089,"@deiapimentinha1 a esquerda sendo a esquerda . nem me surpreendo. para nós fica a lição:é fundamental a união e apoio ao presidente bolsonaro.vamos fortalecer a direita começaremos a votar em candidatos sugeridos por bolsonaro, estratégia que chama. sp russomanno rj crivela bh bruno",positive,"@ deiapimentinha1 the left being the left. I'm not even surprised. for us, the lesson remains: unity and support for president bolsonaro is essential. we will strengthen the right we will start voting for candidates suggested by bolsonaro, a strategy that calls for it. sp russomanno rj crivela bh bruno"
1325497824134443008,"@runawayluxo foda que o povo de são paulo não sabe votar, a prova disso é que os candidatos a prefeito mais votados são covas e russomanno",positive,"@runawayluxo fuck that the people of são paulo do not know how to vote, the proof of that is that the most voted candidates for mayor are caves and russomanno"
1325496897465937920,"@granja_luan sabia q tinha gente doida assim n, achar q o russomanno é de direita",negative,"@granja_luan I knew there were crazy people like that n, think that Russomanno is on the right"
1325496399207784448,@epaminondasoras @hamtaro1659 ele parece com o celso russomanno,neutral,@epaminondasoras @ hamtaro1659 he looks like celso russomanno
1325496295713337344,"@terrivelmentejb @jairbolsonaro que fique a lição para os conservadores no brasil . é fundamental a união e apoio ao presidente bolsonaro. vamos fortalecer a direita começaremos a votar em candidatos sugeridos por bolsonaro , estratégia que chama . prefeito sp : russomanno rj crivela bh bruno .",positive,"@ terriblyjb @jairbolsonaro let the lesson remain for conservatives in brazil. it is essential to unite and support the president bolsonaro. we will strengthen the right, we will start voting for candidates suggested by bolsonaro, a strategy he calls for. mayor sp: russomanno rj crivela bh bruno."
1325496292005572608,"@davy_skidle @eleicoeseua pra mim covas e frança são iguais, dois merdas. sendo que o segundo tem mais chance de aproximação ao bolsonaro. a única diferença seria o boulos mesmo. e o russomanno seria a pior opção disparada.",negative,"@davy_skidle @eleicoeseua for me pits and france are the same, two shits. the second being more likely to approach the Bolsonaro. the only difference would be the boulos. and Russomanno would be the worst option taken."
1325495890153512963,"@guilherme_zenni @ocafezinho guilherme, a pesquisa datafolha desta semana tende a confirmar a migração em massa dos votos do russomanno para o frança e assim nos fortalecemos ainda mais para o 2o turno.",negative,"@guilherme_zenni @ocafezinho guilherme, this week's datafolha survey tends to confirm the massive migration of Russomanno votes to france and thus we are even stronger for the 2nd round."
1325495862806654978,"candidato à prefeitura de são paulo, celso russomanno publicou em seu twitter que apoiará os ""e-games"" na periferia caso seja eleito.",neutral,"candidate for mayor of são paulo, celso russomanno published on his twitter that he will support e-games in the periphery if elected."
1325495579544260610,"@jmarcelomzz que fique a lição para os conservadores no brasil . é fundamental a união e apoio ao presidente bolsonaro. vamos fortalecer a direita começaremos a votar em candidatos sugeridos por bolsonaro , estratégia que chama . prefeito sp : russomanno rj crivela bh bruno .",positive,"@jmarcelomzz let the lesson stay for conservatives in brazil. it is essential to unite and support the president bolsonaro. we will strengthen the right, we will start voting for candidates suggested by bolsonaro, a strategy he calls for. mayor sp: russomanno rj crivela bh bruno."
1325494816457814017,"@leiarachor @crisvivianirj . é fundamental a união e apoio ao presidente bolsonaro. vamos fortalecer a direita começaremos a votar em candidatos sugeridos por bolsonaro , estratégia que chama . prefeito sp : russomanno rj crivela bh bruno .",positive,"@leiarachor @crisvivianirj. it is essential to unite and support the president bolsonaro. we will strengthen the right, we will start voting for candidates suggested by bolsonaro, a strategy he calls for. mayor sp: russomanno rj crivela bh bruno."
1325493668615229443,prefiro o russomanno. nao é o ideal ainda... mas fazer o que com os outros piores?,negative,I prefer Russomanno. it is not ideal yet ... but what to do with the worst?
1325492948319006721,"@marcio37 que fique a lição para os conservadores no brasil . é fundamental a união e apoio ao presidente bolsonaro. vamos fortalecer a direita começaremos a votar em candidatos sugeridos por bolsonaro , estratégia que chama . prefeito sp : russomanno rj crivela bh bruno .",positive,"@ marcio37 let the lesson remain for conservatives in brazil. it is essential to unite and support the president bolsonaro. we will strengthen the right, we will start voting for candidates suggested by bolsonaro, a strategy he calls for. mayor sp: russomanno rj crivela bh bruno."
1325492866244898820,russomanno acha que vai ganhar apoiando o bonoro? kkkkkkkkkkkkkkkkkkkkkkkkkkkkkkkkkkkkkkkkkkkkkkkkkkkkkkkkkkkkkkkk,positive,russomanno think he will win by supporting bonoro? kkkkkkkkkkkkkkkkkkkkkkkkkkkkkkkkkkkkkkkkkkkkkkkkkkkkkkkkkkkkkk
1325492844195434498,"@simone_ss2019 @gfiuza_oficial russomanno é o krl, puta social democrata de bosta, defende controle de preços e fim do uber",negative,"@ simone_ss2019 @gfiuza_oficial russomanno is the krl, the social shit democrat bitch, defends price control and the end of uber"
1325492690725822464,"não se deixe enganar... dia 15, nem covas-dória, nem russomanno-bolsonaro. para são paulo ser feliz, é votar 50 e confirmar @guilhermeboulos e @luizaerundina. #covasnao #foradoria #russomannoodeiapobre #bolsonaroeoproximo #viradacomboulos50 #virasp50 #sdv",positive,"do not be deceived ... on the 15th, neither covas-dória, nor russomanno-bolsonaro. for são paulo to be happy, it's voting 50 and confirming @guilhermeboulos and @luizaerundina. #covasnao #foradoria #russomannoodeiapobre #bolsonaroeoproximo # viradacomboulos50 # virasp50 #sdv"
1325491309830934530,"russomanno e bozonaro juntinhos na propaganda, vergonha q chamaa",negative,"russomanno and bozonaro close together in propaganda, shame q calls"
1325490669603917824,"@alegzahra38 estamos de olho ! por isso precisamos nos unir nas estratégias ! vamos votar em prefeitos sugeridos por bolsonaro. só quem está no olho do furacão para nos mostrar a melhor estratégia . prefeito sp : russomanno , rj crivela.",positive,"@ alegzahra38 we are watching! so we need to come together in strategies! we will vote for mayors suggested by bolsonaro. only those who are in the eye of the storm to show us the best strategy. prefect sp: russomanno, rj crivela."
1325489749403045888,"@luizhpaula11 estamos de olho ! por isso precisamos nos unir . comecemos os jogos e as estratégias ! vamos votar em prefeitos sugeridos por bolsonaro. só quem está no olho do furacão para nos mostrar a melhor estratégia . prefeito sp : russomanno , rj crivela.",positive,"@ luizhpaula11 we are watching! so we need to come together. let's start games and strategies! we will vote for mayors suggested by bolsonaro. only those who are in the eye of the storm to show us the best strategy. prefect sp: russomanno, rj crivela."
1325489700224847873,"@marcio37 por isso precisamos nos unir . comecemos os jogos e as estratégias ! vamos votar em prefeitos sugeridos por bolsonaro. só quem está no olho do furacão para nos mostrar a melhor estratégia . prefeito sp : russomanno , rj crivela.",positive,"@ marcio37 so we need to come together. let's start games and strategies! we will vote for mayors suggested by bolsonaro. only those who are in the eye of the storm to show us the best strategy. prefect sp: russomanno, rj crivela."
1325489529374052354,"@taoquei1 @lialuiz sou de sp votarei para: prefeito: russomanno 10 vereador: edson salomão galera tenham consciência que se não votarem na única chance que temos de lutar, ano que vem será boulos ou covas. engolem o choro, o mimimi e votem no russomanno.",positive,"@ taoquei1 @lialuiz sou de sp will be voting for: mayor: russomanno 10 councilman: edson salomão guys be aware that if you don't vote for the only chance we have to fight, next year it will be boulos or pits. swallow crying, mimimi and vote for Russomanno."
1325489431822946310,@euffernando . acorda brasil . atenção sp tirem o covas da prefeitura! usem à estratégia sugerida por bolsonaro. vamos votar no russomanno! não podemos arriscar covas x boulos . sem mi mi e vamos à luta ! vamos enfraquecer o doria !,neutral,@euffernando. wake up Brazil . attention sp take the caves of the city hall! use the strategy suggested by bolsonaro. let's vote for Russomanno! we cannot risk pits x boulos. without mi mi and let's go to the fight! let's weaken the doria!
1325488325860397056,"@roxmo vivi pra ver o roger defender celso russomanno e consequentemente a igreja universal, impressionante...",positive,"@roxmo I lived to see Roger defend Celso Russomanno and consequently the universal church, impressive ..."
1325486729969668098,"@pauloyunes @maxkobal @danieldamiani13 @brealt mas tem um motivo, os barões da educação privada financiavam as campanhas do pt e do haddad. no fim quem paga a banda escolhe a música né",neutral,"@pauloyunes @maxkobal @ danieldamiani13 @brealt but there is a reason, the private education barons financed the pt and haddad campaigns. in the end who pays the band chooses the song"
1325486627091836928,em são paulo prefeito: celso russomanno.. e caíque mafra - vereador ⁦@caiquemafra38⁩ !! espero que no geral o brasil faça uma grande bancada de direita!! ⁦@jairbolsonaro⁩ precisa muito!! boa tarde,positive,in são paulo mayor: celso russomanno .. and caíque mafra - councilman @ caiquemafra38 !! I hope that in general Brazil will make a big right bench !! @jairbolsonaro needs a lot !! good afternoon
1325484779815530505,"@jairmearrependi todo mundo q pega apoio do presidente se ferra ta que nem o candidato da minha cidade,mesmo partido do russomanno,ta em penultimo nas pesquisas e tem uma general como vice,isso explica mta coisa kkkk",positive,"@jairmearrependi everyone who gets support from the president is screwed up like the candidate in my city, even the Russomanno party, is in penultimate in the polls and has a general as vice, that explains a lot"
1325484619588915202,candidatos a prefeitos apoiados por bolsonaro: rio de janeiro – marcelo crivella 10 são paulo – celso russomanno 10 belo horizonte – bruno engler 28 fortaleza – capitão wagner 90 manaus – coronel menezes 51 recife – delegada patrícia 19 santos – ivan sartori 55 ssa- cézar leite,neutral,candidates for mayors supported by bolsonaro: rio de janeiro - marcelo crivella 10 são paulo - celso russomanno 10 belo horizonte - bruno engler 28 fortaleza - captain wagner 90 manaus - coronel menezes 51 recife - patrícia delegada 19 santos - ivan sartori 55 ssa- cézar leite
1325484182273990663,ex-funcionária da record diz ter sido pressionada por russomanno em caso de assédio moral,neutral,former record employee says she was pressured by Russomanno in case of bullying
1325483932494798848,"sangue de procotó, os candidatos do bozo estão derretendo: trump, crivella, russomanno, capitão wagner, gledson em juazeiro do norte. a esperança vai vencer o ódio!",neutral,"blood of procotó, the candidates of the bozo are melting: trump, crivella, russomanno, captain wagner, gledson in juazeiro do norte. hope will overcome hatred!"
1325483681436344320,"então população da cidade de são paulo! falta 1 semana para as eleições! peço cuidado ao sair de casa e de preferência andem com um guarda-chuva, pois é neste momento eleitoral que o russomanno despenca de vez nas pesquisas e ele pode cair em alguém.",neutral,"then population of the city of são paulo! 1 week to go! I ask for caution when leaving the house and preferably carry an umbrella, because it is at this electoral moment that the Russomanno plummets in the polls and he can fall on someone."
1325483575257522177,"@marleneffl @roalmeidaz @bearpax vamos colocar russomanno, se ele der mole, da próxima vez não ganha nem para vereador. acho que não é isso que ele deseja!!!",positive,"@marleneffl @roalmeidaz @bearpax we’re going to put Russomanno, if he gets soft, next time he wonn’t even win for councilman. I don't think that's what he wants !!!"
1325482414060298240,@ths_cafe verdade russomanno 10 bora gente!!!,positive,@ths_cafe true russomanno 10 let's go !!!
1325481837607735296,"@frankcastle2009 eu não voto na cidade de são paulo, mais me parece bem difícil que russomanno ganhe, a assessoria dele parece bem fraca, sem nenhum atrativo. um candidato que parece não ter nenhum plano de governo, basta assistir o horário político e constatar, lamentável.",negative,"@ frankcastle2009 i don't vote in the city of são paulo, but it seems very difficult for russomanno to win, his advice seems very weak, without any attraction. a candidate who seems to have no government plan, just watch the political schedule and see, regrettable."
1325481462985011201,"cantoneses do brasil apoiam russomanno e marcos da costa. o apoio da associação dos cantoneses foi ratificado em um encontro com o presidente de honra permanente da entidade, carlos su, o atual presidente, luis su, e o vice, mario chen: #cr10prefeito",neutral,"Cantonese of Brazil support Russomanno and landmarks of the coast. the support of the Cantonese association was ratified in a meeting with the entity's permanent honorary president, carlos su, the current president, luis su, and the vice president, mario chen: # cr10preffeito"
1325480073198186502,@fec5588fm agora é russomanno.,neutral,@ fec5588fm is now Russomanno.
1325478832330203138,esses caras sempre estiveram juntos! @brunocovas e russomano são unha e carne covas criou feudo de russomanno no procon com cover de sandy como fiscal,neutral,these guys have always been together! @brunocovas and russomano are nail and meat caves created feud of russomanno at procon with sandy cover as inspector
1325477665713876993,"@arthurmoledoval atacando russomanno pra vê se fica no segundo turno né bobalhão, kkkk",positive,"@arthurmoledoval attacking Russomanno to see if it is in the second round, right, dumbass, kkkk"
1325477036471803906,"@2022enquetes crivella10, fazendo campanha para russomanno 10",neutral,"@ 2022 polls crivella10, campaigning for russomanno 10"
1325476870452699136,"@granja_luan eu n confio n, russomanno n tem 18% dos votos nunca, quanto mais o covas ter quase 30, o tatto tbm n tem mais q o arthur. a unica logica ali é realmente o marcio e o boulos terem voto, o resto eu n acho q dê a lógica n",positive,"@granja_luan I don't trust n, russomanno doesn't have 18% of the votes ever, the more the caves have almost 30, the tbm tatto has no more q arthur. the only logic there is really the marcio and the boulos have a vote, the rest I do not think q gives the logic n"
1325476571852009472,cpp pede impeachment de doria via @youtube esse já está protocolado... dia 15 vou assinar o do covas e de toda esquerda: russomanno 10,neutral,cpp asks for doria impeachment via @youtube this is already filed ... on the 15th i will sign the one for covas and all the left: russomanno 10
1325475824812904448,painel: ex-funcionária da record diz ter sido pressionada por russomanno em caso envolvendo assédio moral,neutral,panel: ex-record employee says she was pressured by Russomanno in case involving bullying
1325475670047281153,@deborabpaim @vemviverfeliz sou bolsonarista mas não votaria em russomanno de forma alguma. prefiro o arthur mamãe falei 51.,neutral,"@deborabpaim @vemviverfeliz i am bolsonarista but i would not vote for russomanno in any way. I prefer mommy arthur, I said 51."
1325474559366213633,pelo menos nas várias pesquisas de intenção de voto russomanno só está caindo.,negative,at least in the various polls of Russomanno intention to vote is only falling.
1325473947220135938,"""vote 10"" - celso russomanno - sp ((vote direito!!!!)) ""direita vota em direita!!!""",positive,"""vote 10"" - celso russomanno - sp ((vote right !!!!)) ""right vote on right !!!"""
1325473650670252032,"""vote 10"" - celso russomanno - sp ((vote direito!!!!)) ""direita vota em direita!!!""",positive,"""vote 10"" - celso russomanno - sp ((vote right !!!!)) ""right vote on right !!!"""
1325473459560910848,russomanno é uma fraude!,neutral,russomanno is a fraud!
1325473208414466051,"é hoje pessoal, assistam!!!! ""vote 10"" - celso russomanno - sp ((vote direito!!!!)) ""direita vota em direita!!!""",positive,"is today guys, watch !!!! ""vote 10"" - celso russomanno - sp ((vote right !!!!)) ""right vote on right !!!"""
1325473170426617857,ex-funcionária da record diz ter sido pressionada por russomanno em caso de assédio moral,neutral,former record employee says she was pressured by Russomanno in case of bullying
1325472236862664704,"""vote 10"" - celso russomanno - sp ((vote direito!!!!)) ""direita vota em direita!!!""",positive,"""vote 10"" - celso russomanno - sp ((vote right !!!!)) ""right vote on right !!!"""
1325472201320116225,"tenho uma tese (bem prosaica, admito) de que russomanno se candidata a prefeito sabendo que não se elege. a finalidade é dividir votos. pessoas com uma noção mínima de respeito ao semelhante não elegem uma pessoa tão má, tão ruim, para comandar uma cidade:",negative,"I have a (very prosaic, I admit) thesis that Russomanno runs for mayor knowing that he is not elected. the purpose is to split votes. people with a minimal notion of respect for others do not elect such a bad person, so bad, to run a city:"
1325472029282275329,"""vote 10"" - celso russomanno - sp ((vote direito!!!!)) ""direita vota em direita!!!""",positive,"""vote 10"" - celso russomanno - sp ((vote right !!!!)) ""right vote on right !!!"""
1325471867310907392,"""vote 10"" - celso russomanno - sp ((vote direito!!!!)) ""direita vota em direita!!!""",positive,"""vote 10"" - celso russomanno - sp ((vote right !!!!)) ""right vote on right !!!"""
1325471780270706688,"@_brunohoffmann se o boulos não roubar mais votos do russomanno principalmente na periferia, acho que é provável que isso aconteça mesmo",positive,"@_brunohoffmann if boulos doesn't steal more votes from russomanno mainly in the periphery, i think it is likely that this will happen"
1325471645180555264,"russomanno e crivella é por falta de opção melhor, né?",positive,"russomanno and crivella is for lack of a better option, right?"
1325471474631778314,"@dimacgarcia é mas tá complicado, kassio, collor, russomanno. convenhamos que pra quem tem independência intelectual é complicado.",negative,"@dimacgarcia is more complicated, kassio, collor, russomanno. we agree that for those who have intellectual independence it is complicated."
1325470670755655683,entre luciano huck e celso russomanno não sei qual odeio mais,negative,between luciano huck and celso russomanno I don't know which one I hate the most
1325470518343061504,"entenderam a jogada!!! ""vote 10"" - celso russomanno - sp ((vote direito!!!!)) ""direita vota em direita!!!""",positive,"understood the move !!! ""vote 10"" - celso russomanno - sp ((vote right !!!!)) ""right vote on right !!!"""
1325470479147282433,@arthurmoledoval não tem um russomanno em fortaleza.,neutral,@arthurmoledoval doesn't have a Russomanno in Fortaleza.
1325469979114950657,covas criou feudo de russomanno no procon com cover de sandy como fiscal #politica,neutral,covas created feud of russomanno in procon with cover of sandy as fiscal #politica
1325469246734929921,"@reginade6 @filhomajeski @dom__andollini anotado querida, agora vai vc surtar com seu apoio ao russomanno",neutral,"@ reginade6 @filhomajeski @dom__andollini annotated dear, now you will freak out with your support for Russomanno"
1325469147950624769,covas criou feudo de russomanno no procon com cover de sandy como fiscal,neutral,covas created feud of russomanno at procon with sandy cover as inspector
1325468657544294400,funcionária da record diz ter sido pressionada por russomanno em caso envolvendo assédio moral,neutral,record employee says she was pressured by Russomanno in case involving bullying
1325468181151035394,"em processo contra a record, em 2018, uma ex-funcionária da emissora alega ter sido pressionada por celso russomanno em um caso envolvendo assédio moral",neutral,"in a lawsuit against the record in 2018, a former employee of the station claims to have been pressured by celso russomanno in a case involving bullying"
1325468130777427976,"@gihzinha83 vai dar boulos ou frança, russomanno caiu pra 16, mas covas vai ganhar sim de qlquer jeito capital e litoral ainda tem salvação, bomba é interior q da 80 pro bolsolixp",positive,"@ gihzinha83 will give boulos or france, russomanno dropped to 16, but pits will win anyway capital and coast still has salvation, bomb is inside q da 80 pro bolsolixp"
1325467904683479040,acordem paulistanos! imaginem um trágico segundo turno entre os comunistas covas e boulos! seria o caos! russomanno é a única alternativa nesse momento! estamos em guerra contra o comunismo! acordem! #fechadocombolsonaro,negative,wake up paulistanos! imagine a tragic second round between the communists pits and boulos! it would be chaos! russomanno is the only alternative right now! we are at war with communism! wake up! #funny
