1325093864500326401,bom dia pra quem tá esperando o ônibus e o celso russomanno passou de carro te cumprimentando,positive,good morning to those who are waiting for the bus and celso russomanno drove by in greeting
1325093058522836993,"russomanno racista usa frases racistas pra dizer que não é racista ,q nem o bolsonaro , mereço! asco",neutral,"russomanno racista uses racist phrases to say he is not racist, not even the bolsonaro, I deserve it! disgust"
1325092994144460801,"q ridículo esse russomanno , alguém explica p ele q hj apenas usamos o termo ''mãe de leite '' para animais q tiveram suas mães mortas ! aff",negative,"q ridiculous this Russomanno, someone explains why he just used the term ""milk mother"" for animals that had their mothers dead! aff"
1325092902167523328,russomanno não cansa de passar vergonha,neutral,russomanno never tires of being ashamed
1325091177364905984,@amandamoraes500 em sp russomanno pode não ser a melhor opção mas é a única! bolsonaro já gravou vídeo dando apoio a ele! ou votamos nele ou deixamos covas continuar com o plano da china!,positive,@ amandamoraes500 in sp russomanno may not be the best option but it is the only one! bolsonaro has already recorded a video supporting him! we either vote for him or let pits continue with china's plan!
1325090177086320641,#eleições2020: bolsonaro aparece pela 1ª vez em programa de tv de russomanno,positive,# elections2020: bolsonaro appears for the first time on a russianmanno tv show
1325088507300175878,"acusado de racismo, russomanno diz ter sido ""criado por mãe de leite negra"" via @youtube",negative,"accused of racism, russomanno says he was ""raised by a black milk mother"" via @youtube"
1325088236977483776,"a imprensa já está preparando o terreno para a segunda onda do “fique em casa” e isto só se tornará realidade se o psdb ou qualquer outro partido de esquerda levar essas eleições. pelo amor de deus, paulistanos, não permitam que isso aconteça. vote 10, vote celso russomanno!",positive,"the press is already preparing the ground for the second wave of ""stay at home"" and this will only become reality if psdb or any other left-wing party takes these elections. for the love of god, paulistanos, do not allow this to happen. vote 10, vote celso russomanno!"
1325088104693325825,"bolsonaro usa aparato público para fazer campanha eleitoral. beneficiados podem ser cassados. entre os promovidos da live estão celso russomanno, marcelo crivella e o seu filho carluxo. * #forabolsonaroeseubandodecriminosos",positive,"bolsonaro uses public apparatus to conduct election campaign. beneficiaries may be forfeited. among those promoted at live are celso russomanno, marcelo crivella and his son carluxo. * #forabolsonaroeseubandodecriminosos"
1325088026645639168,celso russomanno é o cara!,neutral,celso russomanno is the guy!
1325085944773570560,russomanno é condenado a pagar multa por posts contra boulos,positive,russomanno is ordered to pay fine for posts against boulos
1325085890109202432,"vou chamar o celso russomanno, venda casada não pode, quero só os brindes como consta na edição",positive,"I'm going to call celso russomanno, married sales can't, I just want the gifts as shown in the edition"
1325085875324248065,"alô celso russomanno, vai toma no seu cu",neutral,"hello celso russomanno, take it in your ass"
1325085373182128128,sonhei com biden boulos russomanno e louro josé,neutral,I dreamed of biden boulos russomanno and laurel josé
1325084716291256321,"@marciofrancasp que coisa ridícula chamar de #brunodoria, como a besta do russomanno...",negative,"@marciofrancasp what a ridiculous thing to call #brunodoria, like the beast of russomanno ..."
1325084254322225153,@oiiuiz porque não fazer um show também para o russomanno com uma dupla sertaneja?,neutral,@oiiuiz why not do a show for Russomanno with a country duo?
1325081429504651265,"acorda sp, antes que seja tarde demais!!!! vote russomanno 10!! não deixe sp nas mãos do psdb e esquerda!!!",negative,"wake up sp, before it's too late !!!! vote russomanno 10 !! do not leave sp in the hands of psdb and left !!!"
1325081380938788865,"todos que ele apoia , vai sofrer derrota. até o trump. russomanno cai em quase todas as faixas do eleitorado",neutral,everyone he supports will suffer defeat. until the trump. russomanno falls in almost all the electorate bands
1325081322793086976,a prova definitiva que o russomanno é uma pessoa terrível é que estamos entrando na terceira eleição em que ele não consegue dar uma dentro,negative,the definitive proof that the Russomanno is a terrible person is that we are entering the third election in which he is unable to stand in.
1325080590522191872,"não faltava mais nada, russomanno ser prefeito.",negative,"nothing was missing, Russomanno being mayor."
1325079231383150594,@tarcisiogdf @jairbolsonaro estamos satisfeitos com esses avanços ! estamos presenciando obras sem superfaturamento e com qualidade . vamos ficar mais fortes . vamos pra estratégia nessas eleições. bolsonaro sugeriu para prefeito de sp russomanno e rj crivela . de estratégia o presidente entende.,positive,@tarcisiogdf @jairbolsonaro we are satisfied with these advances! we are witnessing works without overpricing and with quality. let's get stronger. we go to strategy in these elections. bolsonaro suggested for mayor of sp russomanno and rj crivela. strategy the president understands.
1325079141788610560,o povo percebendo o quanto o russomanno e burro e despreparado espero que nem pro segundo turno va fracassado de merda,negative,the people realizing how ill and unprepared Russomanno hope that for the second round shit sucks
1325077777507364864,@diogomainardi celso russomanno é um dissimulado.,neutral,@diogomainardi celso russomanno is a sneaky one.
1325077766358831104,"@_colibrisa @bernadinoju @guilhermeboulos frança está pegando os votos do russomanno e cresce que nem vala na periferia, por isso o boulos virou a artilharia pra ele agora, simples assim.",neutral,"@_colibrisa @bernadinoju @guilhermeboulos france is taking the vows of russomanno and it grows like a ditch in the periphery, so boulos has turned the artillery to him now, simple as that."
1325077311675392010,@douglasgarcia sim vamos votar em celso russomanno por favor!,neutral,@douglasgarcia yes we will vote for celso russomanno please!
1325076862230474753,russomanno cai em quase todas as faixas do eleitorado,neutral,russomanno falls in almost all the electorate bands
1325075855597580289,bolsonaro aparece pela 1ª vez no programa eleitoral da tv com russomanno,positive,bolsonaro appears for the first time on the tv electoral program with russomanno
1325074731381428224,"a falha de sp sempre dando um jeito de tirar o candidato da esquerda, no caso boulos, das manchetes. forcando a barra hein @folha? com tendência de queda de russomanno, covas e frança projetam herdar votos, indica datafolha",negative,"the failure of sp always finding a way to remove the candidate from the left, in the case of boulos, from the headlines. forcing the bar huh @ sheet? with declining trend of Russomanno, caves and France project to inherit votes, indicates datafolha"
1325074023177445378,@jozxue odiei amg não gosto de esperar devo chamar o celso russomanno?,negative,@jozxue hated amg don't like to wait should i call celso russomanno?
1325073521492455425,não votem no russomanno o bossonsro declarou apoio à ele,neutral,do not vote for Russomanno the bossonsro declared support for him
1325073444959121410,"russomanno cai em quase todas as faixas do eleitorado, via @o_antagonista #eleições2020",neutral,"russomanno falls in almost all electorate bands, via @o_antagonista # elections2020"
1325073035028787206,russomanno e crivella estudam entrar na justiça contra vídeo do pt; assi... via @youtube,neutral,russomanno and crivella study to sue against pt video; so ... via @youtube
1325072570065018880,"foi o que eu disse ontem, por mais que eu queira ver o boulos no 2 turbo, o caminho tá todo apontado pro frança. ainda dá, mas é difícil",negative,"that's what I said yesterday, as much as I want to see the boulos on the 2 turbo, the path is all pointed to France. it still does, but it's hard"
1325072417547558914,"@diogomainardi russomanno é igual a um peixe: ""morre pela boca"".",neutral,"@diogomainardi russomanno is like a fish: ""it dies by the mouth""."
1325071876620771328,russomanno e crivella estudam entrar na justiça contra vídeo do pt; assi... via @youtube,neutral,russomanno and crivella study to sue against pt video; so ... via @youtube
1325071059792637953,@pcolasse @guilhermeboulos *e digo mais com o ódio que o boulos tá do russomanno por humilhar a classe trabalhadora*,positive,@pcolasse @guilhermeboulos * and I say more with the hatred that boulos is from russomanno for humiliating the working class *
1325070955698413570,russomanno e crivella estudam entrar na justiça contra vídeo do pt; assi... via @youtube,neutral,russomanno and crivella study to sue against pt video; so ... via @youtube
1325070902145523712,"@pcolasse @guilhermeboulos irmão, numa rinha corpo a corpo entre o boulos e o russomanno, quem você acha que venceria?",positive,"@pcolasse @guilhermeboulos brother, in a melee fight between boulos and russomanno, who do you think would win?"
1325070271938695170,@veramagalhaes verinha 500k eu não sei quem e mas lixo se e vc ou russomanno kkkk,neutral,@veramagalhaes verinha 500k I don't know who is but trash if you or Russomanno kkkk
1325070229999931392,"com tendência de queda de russomanno, covas e frança projetam herdar votos, indica datafolha",neutral,"with declining trend of Russomanno, caves and France project to inherit votes, indicates datafolha"
1325069944732704769,"vê se dá pra entender... votar em levi é jogar o voto fora, a disputa será psdb e pt/psol. só russomanno pode tirar esses 2 de lá! é o melhor candidato, é o que queríamos? não!! mas é o que temos!",positive,"see if you can understand ... to vote for levi is to throw the vote away, the dispute will be psdb and pt / psol. only Russomanno can get those 2 out of there! is the best candidate, is that what we wanted? not!! But it is what we have!"
1325069449494466561,"acusado de racismo, russomanno diz ter sido ""criado por mãe de leite negra"" via @youtube",negative,"accused of racism, russomanno says he was ""raised by a black milk mother"" via @youtube"
1325068888934060034,bolsonaro aparece pela 1ª vez no programa eleitoral da tv com russomanno:,positive,bolsonaro appears for the first time on the tv electoral program with russomanno:
1325068886413352968,"já o candidato celso russomanno (@celsorussomanno) , deputado federal, repórter, piloto de avião e bacharel em direito, traz como proposta de governo “avançar no fortalecimento dos programas de atenção em saúde dirigidos aos grupos populacionais prioritários e de alto risco +",neutral,"the candidate celso russomanno (@celsorussomanno), federal deputy, reporter, airline pilot and bachelor of law, brings as a government proposal “to advance in the strengthening of health care programs directed to priority and high-risk population groups +"
1325068433495633923,"""márcio frança é segunda opção para 30% dos eleitores de boulos""",neutral,"""marcio france is the second option for 30% of voters in boulos"""
1325067173321125890,russomanno é condenado a pagar multa por posts contra boulos,positive,russomanno is ordered to pay fine for posts against boulos
1325066917569290240,@carteiroreaca @douglasgarcia esse gil é celso russomanno juntos com o marcos pereira não presta atenção eles estão contra o povo brasileiro e se agora eles já não se preocupam com o povo imagina se ganhar por isso #foracelso #obrasilexige600.,positive,@carteiroreaca @douglasgarcia this gil is celso russomanno together with marcos pereira pays no attention they are against the brazilian people and if now they no longer care about the people imagine if they win by that #foracelso # obrasilexige600.
1325066478668849155,bolsonaro aparece pela 1ª vez no programa eleitoral da tv com russomanno,positive,bolsonaro appears for the first time on the tv electoral program with russomanno
1325066030079684608,a hora de tatto colocar a mão na consciência,neutral,tatto time to put your hand on conscience
1325063873297321987,juiz condena russomanno a pagar multa de r$ 5 mil por posts contra boulos via @uolnoticias @uol,positive,"judge condemns Russomanno to pay $ 5,000 fine for posts against boulos via @uolnoticias @uol"
1325063448322043904,"@juliaduailibi adorei o argumento da panaceia... realmente não entendo essa lógica do russomanno se aproximar do bolsonaro para ganhar votos! ele já é candidato ""bolsonarista"" e foi isso que ele conseguiu. cair!",positive,"@juliaduailibi I loved the panacea argument ... I really don't understand this logic of Russomanno approaching the Bolsonaro to win votes! he is already a ""bolsonarista"" candidate and that is what he achieved. fall!"
1325062569481080836,"entre os promovidos da live estão celso russomanno, marcelo crivella e o seu filho carlos bolsonaro",positive,"among those promoted on live are celso russomanno, marcelo crivella and his son carlos bolsonaro"
1325062200655044609,"@dcm_online a intenção de aplicação da condenação é a forma de coibir uma nova atuação, logo, r$ 5 mil tem o condão de inibir, um racista que em pleno 2020 fala em mama de leite preta! assim, posso afirmar que, a sua vó russomanno, ""não exitou quando mandou a minha lá pro tronco"".",negative,"@dcm_online the intention of applying the condemnation is the way to restrain a new performance, therefore, $ 5,000 has the power to inhibit, a racist who in the middle of 2020 talks about black milk breast! thus, I can say that, her grandmother Russomanno, ""did not hesitate when she sent mine over the trunk""."
1325062139715969025,qualquer prefeito novo vai querer fuçar no orçamento da cidade pra caçar voto pra 2022 ou 2024. o russomanno é putinha do bolsonaro e do edir. o frança é demagogo. foi um péssimo governador tentando caçar voto pra ser eleito em 2018 ou agora em 2020. o boulos fede a haddad.,negative,any new mayor will want to dig into the city budget to hunt for votes for 2022 or 2024. Russomanno is a bitch from Bolsonaro and Edir. France is a demagogue. he was a terrible governor trying to hunt for a vote to be elected in 2018 or now in 2020. boulos stinks of haddad.
1325061981582159872,so a violência da milicia explicaria a vitoria de carluxo ou a mãe no rio de janeiro nunca trabalharam e a rejeição do pai e do irmão flavio é coisa criminosa,negative,only the violence of the militia would explain the victory of carluxo or the mother in rio de janeiro they never worked and the rejection of father and brother flavio is a criminal thing
1325061147687591936,"""um símbolo marxista"". aiaiaiai russomanno...",neutral,"""a Marxist symbol"". aiaiaiai russomanno ..."
1325060834637254656,"a imprensa já está preparando o terreno para a segunda onda do “fique em casa” e isto só se tornará realidade se o psdb ou qualquer outro partido de esquerda levar essas eleições. pelo amor de deus, paulistanos, não permitam que isso aconteça. vote 10, vote celso russomanno!",positive,"the press is already preparing the ground for the second wave of ""stay at home"" and this will only become reality if psdb or any other left-wing party takes these elections. for the love of god, paulistanos, do not allow this to happen. vote 10, vote celso russomanno!"
1325060770128945152,"sim, verdade. mas a rejeição ao márcio frança diminuiu tb. tem que se preocupar mais com @marciofrancasp. covas está garantido e russomanno... já era o @celsorussomanno",positive,Yes true. but the rejection of marcio france decreased also. have to worry more about @marciofrancasp. pits are guaranteed and russomanno ... it was already @celsorussomanno
1325060503941513216,russomanno e crivella estudam entrar na justiça contra vídeo do pt; assista enquanto dá tempo,neutral,russomanno and crivella study to sue against pt video; watch while you have time
1325060481493692417,#livetvesmael - russomanno e crivella estudam entrar na justiça contra vídeo do pt; assista enquanto dá tempo,neutral,#livetvesmael - russomanno and crivella study to sue against pt video; watch while you have time
1325060234205945856,"em queda, russomanno sofre com trapalhadas e conflitos em sua campanha | maquiavel",negative,"in fall, russomanno suffers from problems and conflicts in his campaign | Machiavelli"
1325060215360921602,datafolha: russomanno cai e boulos encosta; covas lidera disputa - cartacapital,neutral,data sheet: russomanno falls and boulos hillside; covas leads dispute - cartacapital
1325060011635208192,"votem em russomanno, povo de são paulo, bora tirar o covas cemiterio",neutral,"Vote in Russomanno, people of São Paulo, let's take the cemetery graves"
1325059952944295937,russomanno cai em quase todas as faixas do eleitorado bolsonaro ou ele que é tóxico na visão dos eleitores ou os dois juntos ?,neutral,russomanno falls in almost all bands of the bolsonaro electorate or is he toxic in the eyes of voters or both together?
1325059707984285696,russomanno é condenado a pagar multa por posts contra boulos,positive,russomanno is ordered to pay fine for posts against boulos
1325058865709330432,"russomanno diz não ver diferença entre negros e brancos: “fui criado por uma mãe de leite, negra” eu sou uma pessoa que não vejo diferença entre os negros e os brancos"", afirmou russomanno (republicanos). eu não vou polarizar essa questão. eu fui criado…",negative,"russomanno says he doesn't see any difference between blacks and whites: ""i was raised by a mother of milk, black"" i'm a person that i don't see any difference between blacks and whites "", said russomanno (republicans). i will not polarize this issue. I was created ..."
1325058377148493826,"se você é douglas garcia, siga o seu voto em celso russomanno , anotado ?",neutral,"if you are douglas garcia, follow your vote in celso russomanno, annotated?"
1325057789333565441,"@jplaet n estou defendendo, talvez até votaria nele, se fosse eleitor de lá, mas n iria morrer em sua defesa. sim, acredito q ele é o único da esquerda, centro esquerda, centro seja o q for, pra derrotar russomanno ou covas. o resto perde de lavada. ""esquerda"" pra perder é o msm q nada.",negative,"@jplaet I'm not defending, maybe I would even vote for him, if he were a voter there, but I wouldn't die in his defense. yes, I believe he is the only one on the left, center left, center whatever he is, to defeat Russomanno or pits. the rest is washed away. ""left"" to lose is the msm q nothing."
1325057660492898305,russomanno é condenado a pagar multa por posts contra boulos,positive,russomanno is ordered to pay fine for posts against boulos
1325056822194155520,celso russomanno é condenado a pagar multa por posts contra boulos * #russomannolixo,positive,celso russomanno is ordered to pay fine for posts against boulos * #russomannolixo
1325056243824783361,@bronco_clubista @cougarsbr 1º - covas 2º - russomanno 3 - boulos 4 - frança,neutral,@bronco_clubista @cougarsbr 1st - caves 2nd - russomanno 3 - boulos 4 - france
1325056209452412929,"@julianlemosopb1 nos pleitos desse ano algumas faturas já chegaram, como os fiascos das candidaturas de russomanno e crivella e a fatura maior, #pénabundadocapitão, será apresentada e cobrada em outubro de 2022. faltam 2 anos, 1 mês e 23 dias para virarmos essa página e darmos #pénabundadocapitão",neutral,"@ julianlemosopb1 in the elections this year, some invoices have arrived, such as the fiascos of russomanno and crivella candidacies and the bigger invoice, # pénabundadocapitão, will be presented and charged in October 2022. 2 years, 1 month and 23 days to turn this page and give # pénabundadocapitão"
1325055904895676417,@estadao desejo a todos os candidatos para os quais bolsonaro está fazendo campanha a mesma sorte que o presidente vem dando a russomanno e crivella. rumo ao fundo do poço!,neutral,@estadao I wish all the candidates for whom Bolsonaro is campaigning the same luck that the president has been giving Russomanno and Crivella. towards rock bottom!
1325055747399557120,"bolsonaro como cabo eleitoral é igual ao lula, só recomenda candidato bom, quem não lembra do lula dizendo que votar no sérgio cabral era uma obrigação moral. que são paulo não cometa esse erro.",positive,"bolsonaro as an electoral cape is the same as the squid, he only recommends a good candidate, who does not remember the squid saying that voting for sergio cabral was a moral obligation. that são paulo does not make this mistake."
1325055172524056577,"com tendência de queda de russomanno, covas e frança projetam herdar votos, indica datafolha",neutral,"with declining trend of Russomanno, caves and France project to inherit votes, indicates datafolha"
1325055101195706369,"outra coisa é que o eleitor de russomanno nunca vai trocar russomanno por guilherme boulos ou mamãe falei, na verdade boulos e mamãe falei são muito parecidos embora e ideologicamente estejam em polos diferentes são parecidos pelo estereótipo político de deles",neutral,"another thing is that the voter of russomanno will never exchange Russomanno for guilherme boulos or mommy said, in fact boulos and mommy said are very similar although and ideologically they are in different poles are similar by their political stereotype"
1325054619026911232,"@diogomainardi o antagonista ainda não entendeu o que as próprias pesquisas em sp já demonstraram o eleitor bolsonarista aquele do ótimo ou bom 25 % não vai votar em ninguém, é tão simples vermos que russomanno está apresentando o capital político que apresenta em todas as eleições.",positive,"@diogomainardi the antagonist still doesn’t understand what the polls in sp have already shown that the voter of the Bolsonarist that the excellent or good 25% will not vote for anyone, it is so simple to see that Russomanno is presenting the political capital that he presents in all elections."
1325054397324398595,vou desenhar prá vocês - porque votar em russomanno ??,neutral,I will draw for you - why vote for Russomanno ??
1325054229321486336,"porque o perfil de russomano não tem nada a ver com o perfil de boulos, o eleitor que escolhe russomanno não vai trocar russomanno por boulos ou por mamãe falei por exemplo, por isso eu falei que bolo chegou no teto dele e frança tem a possibilidade de ultrapassa-lo",neutral,"because the profile of Russomano has nothing to do with the profile of boulos, the voter who picks Russomanno is not going to exchange Russomanno for boulos or for mother I spoke for example, so I said that cake arrived on his roof and France has the possibility of surpass it"
1325053857655894016,lembrando que o russomanno falou que quer incentivar o turismo gastronômico em sp pq lá eles tem a melhor comida do mundo. mto bom essa bosta aqui,positive,remembering that russomanno said he wants to encourage gastronomic tourism in sp cuz there they have the best food in the world. very good this shit here
1325053770858975239,"falta 1 semana para a eleição municipal e devemos ficar atentas ao que candidatos estão falando. ontem, por exemplo, russomanno disse que teve mãe de leite negra para justificar que não é racista. disse também que tem amigos negros e já teve até namorada",negative,"1 week before the municipal election and we must pay attention to what candidates are talking about. yesterday, for example, russomanno said he had a black milk mother to justify that he is not racist. he also said he has black friends and even had a girlfriend"
1325053443720011780,"cariocas e paulistas, se vcs não querem ser governados por esquerdista comunista, ladrão, invasores de propriedades, soldado declarado do lula, amigos do cabral, pezão, quadrilheiros... votem no crivella; votem no russomanno! @mcrivella @celsorussomanno",neutral,"cariocas and paulistas, if you don't want to be ruled by communist leftists, thieves, property invaders, declared squid soldiers, friends of the cabral, big guys, gangsters ... vote for crivella; vote for Russomanno! @mcrivella @celsorussomanno"
1325053381182943233,@gisaieira vamos fazer a nossa parte divulgando os prefeitos sugeridos por bolsonaro sp : russomanno rj : crivela bolsonaro está nos bastidores e tem melhor estratégia para enfraquecer o retorno da esquerda .,positive,@gisaieira let's do our part by publicizing the mayors suggested by bolsonaro sp: russomanno rj: crivela bolsonaro is behind the scenes and has a better strategy to weaken the left's return.
1325052907767664644,essa derrota do russomano é uma prévia do que será 2022 para presidente!,neutral,this Russomano's defeat is a preview of what will be 2022 for president!
1325052887890882563,@reyfigueiredo @jairbolsonaro vamos fazer a nossa parte divulgando os prefeitos sugeridos por bolsonaro sp : russomanno rj : crivela bolsonaro está nos bastidores e tem melhor estratégia para enfraquecer o retorno da esquerda .,positive,@reyfigueiredo @jairbolsonaro we will do our part by publicizing the mayors suggested by bolsonaro sp: russomanno rj: crivela bolsonaro is behind the scenes and has a better strategy to weaken the left's return.
